Title	Authors	Pdf	Presentation	Volume_Name	Raw_webtext
Expanding MT Horizons
Table of Contents
Papers
An example-based approach to machine translation	Bróna Collins and Pádraig Cunningham and Tony Veale	http://www.mt-archive.info/90/AMTA-1996-Collins.pdf		Papers	An example-based approach to machine translation -- Bróna Collins, Pádraig Cunningham, and Tony Veale; pp.1-13 [PDF, 259KB]
A controlled skip parser	Kenji Yamada	http://www.mt-archive.info/90/AMTA-1996-Yamada.pdf		Papers	A controlled skip parser -- Kenji Yamada; pp.14-23 [PDF, 155KB]
Juggling with words: some insights from the human translation process	Claude Bédard	http://www.mt-archive.info/90/AMTA-1996-Bedard.pdf		Papers	Juggling with words: some insights from the human translation process -- Claude Bédard; pp.24-33 [PDF, 160KB]
Bilingual concordancers:a new tool for bilingual lexicographers	Lucie Langlois	http://www.mt-archive.info/90/AMTA-1996-Langlois.pdf		Papers	Bilingual concordancers:a new tool for bilingual lexicographers -- Lucie Langlois; pp.34-42 [PDF, 143KB]
Translation differences and pragmatics-based MT	Stephen Helmreich and David Farwell	http://www.mt-archive.info/90/AMTA-1996-Helmreich.pdf		Papers	Translation differences and pragmatics-based MT -- Stephen Helmreich and David Farwell; pp.43-55 [PDF, 162KB]
Abstraction and underspecification in semantic transfer	Bernd Abb and Bianka Buschbeck-Wolf and Christel Tschernitschek	http://www.mt-archive.info/90/AMTA-1996-Abb.pdf		Papers	Abstraction and underspecification in semantic transfer -- Bernd Abb, Bianka Buschbeck-Wolf, and Christel Tschernitschek; pp.56-65 [PDF, 186KB]
Lexical knowledge from large corpora and its application to text generation	Isahara Hitoshi and Inui Hiroko and Uchida Yuriko	http://www.mt-archive.info/90/AMTA-1996-Isahara.pdf		Papers	Lexical knowledge from large corpora and its application to text generation -- Isahara Hitoshi, Inui Hiroko, and Uchida Yuriko; pp.66-75 [PDF, 362KB]
Capturing motion verb generalizations in synchronous tree adjoining grammars	Martha Palmer and Joseph Rosenzweig	http://www.mt-archive.info/90/AMTA-1996-Palmer.pdf		Papers	Capturing motion verb generalizations in synchronous tree adjoining grammars -- Martha Palmer and Joseph Rosenzweig; pp.76-85 [PDF, 177KB] 
Evolution of the Logos grammar: system design and development methodology	Patricia Schmid and Claudia Gdaniec	http://www.mt-archive.info/90/AMTA-1996-Schmid.pdf		Papers	Evolution of the Logos grammar: system design and development methodology -- Patricia Schmid and Claudia Gdaniec; pp.86-95 [PDF, 169KB]
Two principles and six techniques for rapid MT development	Sergei Nirenburg and Stephen Beale and Stephen Helmreich and Kavi Mahesh and Evelyne Viegas and Rémi Zajac	http://www.mt-archive.info/90/AMTA-1996-Nirenburg.pdf		Papers	Two principles and six techniques for rapid MT development -- Sergei Nirenburg, Stephen Beale, Stephen Helmreich, Kavi Mahesh, Evelyne Viegas, and Rémi Zajac; pp. 96-105 [PDF, 159KB]
Adaptation of the DARPA machine translation evlauation paradigm to end-to-end systems	John S.White and Theresa A. O'Connell	http://www.mt-archive.info/90/AMTA-1996-White-1.pdf		Papers	Adaptation of the DARPA machine translation evlauation paradigm to end-to-end systems -- John S.White and Theresa A. O'Connell; pp.106-114 [PDF, 141KB]
Combining machine readable lexical resources and bilingual corpora for broad word sense disambiguation	Jason J.S.Chang and Jen-Nan Chen and Huei-Hong Sheng and Sur-Jin Ker	http://www.mt-archive.info/90/AMTA-1996-Chang.pdf		Papers	Combining machine readable lexical resources and bilingual corpora for broad word sense disambiguation -- Jason J.S.Chang, Jen-Nan Chen, Huei-Hong Sheng, and Sur-Jin Ker; pp. 115-124 [PDF, 299KB]
Automatic construction of clean broad-coverage translation lexicons	I. Dan Melamed	http://www.mt-archive.info/90/AMTA-1996-Melamed.pdf		Papers	Automatic construction of clean broad-coverage translation lexicons -- I. Dan Melamed; pp. 125-134 [PDF, 431KB]
Bilingual sentence alignment: balancing robustness and accuracy	Michel Simard and Pierre Plamondon	http://www.mt-archive.info/90/AMTA-1996-Simard.pdf		Papers	Bilingual sentence alignment: balancing robustness and accuracy -- Michel Simard and Pierre Plamondon; pp. 135-144 [PDF, 230KB]
Line 'em up: advances in alignment technology and their impact on translation support tools	Elliott Macklovitch and Marie-Louise Hannan	http://www.mt-archive.info/90/AMTA-1996-Macklovitch.pdf		Papers	Line 'em up: advances in alignment technology and their impact on translation support tools -- Elliott Macklovitch and Marie-Louise Hannan; pp. 145-156 [PDF, 179KB]
Checking translations for inconsistency - a tool for the editor	Magnus Merkel	http://www.mt-archive.info/90/AMTA-1996-Merkel.pdf		Papers	Checking translations for inconsistency - a tool for the editor -- Magnus Merkel; pp. 157-167 [PDF, 38KB]
Space, metaphor and schematization in sign: sign language translation in the ZARDOZ system	Tony Veale and Bróna Collins	http://www.mt-archive.info/90/AMTA-1996-Veale.pdf		Papers	Space, metaphor and schematization in sign: sign language translation in the ZARDOZ system -- Tony Veale and Bróna Collins; pp. 168-179 [PDF, 203KB]
Combing language technolgy and web technology to streamline an automotive hotline support service	Jörg Schütz	http://www.mt-archive.info/90/AMTA-1996-Schutz.pdf		Papers	Combing language technolgy and web technology to streamline an automotive hotline support service -- Jörg Schütz; pp. 180-189 [PDF, 151KB]
Featured Speaker Papers
Two years online: experiences, challenges and trends	Mary Flanagan	http://www.mt-archive.info/90/AMTA-1996-Flanagan-1.pdf		Featured Speaker Papers	Two years online: experiences, challenges and trends -- Mary Flanagan; pp. 192-197 [PDF, 86KB]
The state of machine translation in Europe	John Hutchins	http://www.mt-archive.info/90/AMTA-1996-Hutchins.pdf		Featured Speaker Papers	The state of machine translation in Europe -- John Hutchins; pp. 198-205 [PDF, 105KB]
"""Specialized"" machine translation"	John Chandioux and Annette Grimaila	http://www.mt-archive.info/90/AMTA-1996-Chandioux-1.pdf		Featured Speaker Papers	"""Specialized"" machine translation -- John Chandioux and Annette Grimaila; pp. 206-211 [PDF, 104KB]"
The primacy of core technology MT evaluation	John S.White	http://www.mt-archive.info/90/AMTA-1996-White-2.pdf		Featured Speaker Papers	The primacy of core technology MT evaluation -- John S.White; pp. 212-218 [PDF, 123KB]
Panel Statements
System Demonstrations
ANTHEM:advanced natural language interface for multilingual text generation in healthcare (LRE 62-007)	G.Deville and E.Herbigniaux and P.Mousel and G.Thienpont and M.Wéry	http://www.mt-archive.info/90/AMTA-1996-Deville.pdf		System Demonstrations	ANTHEM:advanced natural language interface for multilingual text generation in healthcare (LRE 62-007) -- G.Deville, E.Herbigniaux, P.Mousel, G.Thienpont and M.Wéry; pp. 240-243 [PDF, 86KB]
Online MT at Compuserve	Mary Flanagan	http://www.mt-archive.info/90/AMTA-1996-Flanagan-2.pdf		System Demonstrations	Online MT at Compuserve -- Mary Flanagan; pp. 244-246 [PDF, 69KB]
ITSVOX	Eric Wehrli	http://www.mt-archive.info/90/AMTA-1996-Wehrli.pdf		System Demonstrations	ITSVOX -- Eric Wehrli; pp. 247-251 [PDF, 116KB]
JANUS: multi-lingual translation of spontaneous speech in limited domain	Alon Lavie and Lori Levin and Alex Waibel and Donna Gates and Marsal Gavalda and Laura Mayfield	http://www.mt-archive.info/90/AMTA-1996-Lavie.pdf		System Demonstrations	JANUS: multi-lingual translation of spontaneous speech in limited domain -- Alon Lavie, Lori Levin, Alex Waibel, Donna Gates, Marsal Gavalda, and Laura Mayfield; pp. 252-255 [PDF, 144KB]
JAPANGLOSS: using statistics to fill knowledge gaps	Kevin Knight and Yaser Al-Onaizan and Ishwar Chander and Eduard Hovy and Irene Langkilde and Richard Whitney and Kenji Yamada	http://www.mt-archive.info/90/AMTA-1996-Knight.pdf		System Demonstrations	JAPANGLOSS: using statistics to fill knowledge gaps -- Kevin Knight, Yaser Al-Onaizan, Ishwar Chander, Eduard Hovy, Irene Langkilde, Richard Whitney, and Kenji Yamada; pp. 256 [PDF, 81KB]
JICST Japanese-English machine translation system	Patricia O'Neill-Brown	http://www.mt-archive.info/90/AMTA-1996-ONeill-Brown.pdf		System Demonstrations	JICST Japanese-English machine translation system -- Patricia O'Neill-Brown; pp. 257-260 [PDF, 119KB] 
LEXIUM	John Chandioux and Annette Grimaila	http://www.mt-archive.info/90/AMTA-1996-Chandioux-2.pdf		System Demonstrations	LEXIUM -- John Chandioux and Annette Grimaila; pp. 261-263 [PDF, 65KB]
Logos Intelligent Translation System	Winfield Scott Bennett	http://www.mt-archive.info/90/AMTA-1996-Bennett.pdf		System Demonstrations	Logos Intelligent Translation System -- Winfield Scott Bennett; pp. 264-267 [PDF, 93KB]
The Pangloss-Lite machine translation system	Robert E. Frederking and Ralf D. Brown	http://www.mt-archive.info/90/AMTA-1996-Frederking.pdf		System Demonstrations	The Pangloss-Lite machine translation system -- Robert E. Frederking and Ralf D. Brown; pp. 268-272 [PDF, 116KB]
PARS and PARS/U machine translation systems: English-Russian-English and English-Ukrainian-English	Michael S. Blekhman	http://www.mt-archive.info/90/AMTA-1996-Blekhman.pdf		System Demonstrations	PARS and PARS/U machine translation systems: English-Russian-English and English-Ukrainian-English -- Michael S. Blekhman; pp. 273-276 [PDF, 82KB]
SYSTRAN Chinese-English MT, ECI Chinese OCR - CHIOCR	Laurie Gerber	http://www.mt-archive.info/90/AMTA-1996-Gerber.pdf		System Demonstrations	SYSTRAN Chinese-English MT, ECI Chinese OCR - CHIOCR -- Laurie Gerber; pp. 277-279 [PDF, 70KB]
Towards a multilingual analyst's workstation: Temple	Rémi Zajac	http://www.mt-archive.info/90/AMTA-1996-Zajac.pdf		System Demonstrations	Towards a multilingual analyst's workstation: Temple -- Rémi Zajac; pp. 280-284 [PDF, 183KB]
Trados translator's workbench	Mark Berry	http://www.mt-archive.info/90/AMTA-1996-Berry.pdf		System Demonstrations	Trados translator's workbench -- Mark Berry; pp. 285-289 [PDF, 188KB]
Other presentations
