Title	Authors	Pdf	Presentation	Volume_Name	Notes
ReEscreve: a Translator-friendly Multi-purpose Paraphrasing Software Tool	Anabela Barreiro and Luis Miguel Cabral	http://www.mt-archive.info/05/MTS-2009-Barreiro.pdf			Beyond Translation Memories: New Tools for Translators Workshop
The Web as a Source of Informative Background Knowledge	Caroline Barrière	http://www.mt-archive.info/05/MTS-2009-Barriere.pdf			Beyond Translation Memories: New Tools for Translators Workshop
A Web Service Enabling Gradable Post-edition of Pre-translations Produced by Existing Translation Tools: Practical Use to Provide High-quality Translation of an Online Encyclopedia	Hervé Blanchon and Christian Boitet and Cong-Phap Huynh	http://www.mt-archive.info/05/MTS-2009-Blanchon.pdf			Beyond Translation Memories: New Tools for Translators Workshop
Grounding Translation Tools in Translator’s Activity Data	Michael Carl	http://www.mt-archive.info/05/MTS-2009-Carl.pdf			Beyond Translation Memories: New Tools for Translators Workshop
How Translators Use Tools and Resources to Resolve Translation Problems: an Ethnographic Study	Alain Désilets and Christiane Melançon and Geneviève Patenaude and Louise Brunette	http://www.mt-archive.info/05/MTS-2009-Desilets-2.pdf			Beyond Translation Memories: New Tools for Translators Workshop
Bitextor: a Free/Open-source Software to Harvest Translation Memories from Multilingual Websites	Miquel Esplà-Gomis	http://www.mt-archive.info/05/MTS-2009-Espla-Gomis.pdf			Beyond Translation Memories: New Tools for Translators Workshop
Productivity and Quality in MT Post-editing	Ana Guerberof	http://www.mt-archive.info/05/MTS-2009-Guerberof.pdf			Beyond Translation Memories: New Tools for Translators Workshop
